{
  "schema_version": "1.3.3",
  "suite_version": "1.3.3",
  "generated_at": "2026-10-23T12:00:00+00:00",
  "builder": "fixture-builder",
  "target_platform": {
    "os": "windows-11",
    "python": "3.12.14",
    "node": "20.11.1"
  },
  "normalization": {
    "path_separator": "/",
    "case_policy": "casefolded_windows",
    "eol_normalized": false
  },
  "files": [
    {
      "path": "runtime/uiux_engine/cli.py",
      "sha256": "449d46216357679d29226424a405692fd1e960e2355e61d2d8009287984fef40",
      "size": 100,
      "role": "runtime"
    },
    {
      "path": "contracts/task-request.v1.3.3.schema.json",
      "sha256": "2cff95f0cc88db415e7a85043fa05f21df325272cf023141cbd1312229252725",
      "size": 100,
      "role": "schema"
    },
    {
      "path": "skills/uiux/SKILL.md",
      "sha256": "3ae200b1e43301eecf0366bae40511041aa825e051d20f121476606b8922fb04",
      "size": 100,
      "role": "skill"
    },
    {
      "path": "skills/uiux/scripts/launch.py",
      "sha256": "d4f5f7f76266f8ad7d370c4993fd57ed9f6ba87fc7a2edbdb69421c042ffebcb",
      "size": 100,
      "role": "launcher"
    },
    {
      "path": "LICENSE",
      "sha256": "bd84daf23e7f5febd03016632c17a6a1827c836e8827f6fe9c571bbaa309eb23",
      "size": 100,
      "role": "license"
    }
  ],
  "excluded_patterns": [
    "**/__pycache__/**",
    "**/*.pyc",
    ".venv/**"
  ],
  "include_launcher": true,
  "include_schemas": true,
  "include_licenses": true,
  "bundle_sha256": "1e6ed65d77d6364eeaed5a745ba5c4985ae2b700dd85d7cf7f027bdf294a33fc"
}
